べんきょうしている人の _______ になりますから、しずかにしてください。,けんか,じゃま,だめ,いや,じゃま,言い換え類義,N4,N4-21-5
父はるすです。,父は出かけています。,父はいそがしいです。,父はうちにいます。,父はねています。,父は出かけています。,文脈規定,N4,N4-21-6
そのニュースを聞いてびっくりしました。,そのニュースを聞いてよろこびました。,そのニュースを聞いておもいだしました。,そのニュースを聞いてわかりました。,そのニュースを聞いておどろきました。,そのニュースを聞いておどろきました。,文脈規定,N4,N4-21-7
ここはすばらしいえを見せるところです。,ここはびじゅつかんです。,ここはどうぶつえんです。,ここはとしょかんです。,ここはたいしかんです。,ここはびじゅつかんです。,文脈規定,N4,N4-21-8
あした先生のおたくにうかがいます。,あした先生のおたくにいらっしゃいます。,あした先生のおたくにかえります。,あした先生のおたくにまいります。,あした先生のおたくにみえます。,あした先生のおたくにまいります。,文脈規定,N4,N4-21-9
こどもはおとうさんにしかられました。,こどもはおとうさんにわらわれました。,こどもはおとうさんにほめられました。,こどもはおとうさんにそだてられました。,こどもはおとうさんにおこられました。,こどもはおとうさんにおこられました。,文脈規定,N4,N4-21-10
7時にレストランを _______ してあります。,ごちそう,よしゅう,やくそく,よやく,よやく,言い換え類義,N4,N4-20-1
車のかぎはきのう _______ ここにありました。,きゅうに,じゆうに,たしかに,じょうぶに,たしかに,言い換え類義,N4,N4-20-2
わたしは日本のぶんがくに _______ があります。,けいざい,きょうみ,ねっしん,せいじ,きょうみ,言い換え類義,N4,N4-20-3
すみませんが、たなかさんのでんわばんごうを _______ ください。,かけて,おしえて,こたえて,せつめいして,おしえて,言い換え類義,N4,N4-20-4
「ケンさんはほんとうに日本語がじょうずですね。」「いえ、_______でもありません。」,ほんとう,それほど,ほとんど,なるほど,それほど,言い換え類義,N4,N4-20-5
わたしがとうきょうにいったとき、山川さんが _______ してくれた。,あんない,うんどう,けんぶつ,よてい,あんない,言い換え類義,N4,N4-20-6
きむらくんと _______ して、けがをしてしまった。,けんか,けいけん,しょうち,しょうかい,けんか,言い換え類義,N4,N4-20-7
わたしの国はアジアの国々との _______ がさかんです。,かがく,けいけん,ぼうえき,よしゅう,ぼうえき,言い換え類義,N4,N4-20-8
むずかしいもんだいでしたが、_______ こたえがわかりました。,もうすぐ,なかなか,ちっとも,やっと,やっと,言い換え類義,N4,N4-20-9
車が _______ 、うごかなくなってしましました。,こしょうして,うんてんして,うんどうして,しっぱいして,こしょうして,言い換え類義,N4,N4-20-10
せんたく,しょくじのあとに、はをせんたくします。,日よう日に シャツとズボンをせんたくします。,毎日へやをせんたくします。,こんばんはかみをせんたくします。,日よう日に シャツとズボンをせんたくします。,文脈規定,N4,N4-19-1
どんどん,えいがを見てどんどんわらいました。,休みの日はどんどんねています。,あかちゃんはどんどん大きくなります。,オートバイがどんどんはやいです。,あかちゃんはどんどん大きくなります。,文脈規定,N4,N4-19-2
とうとう,しょくじのあとでとうとうおちゃをおねがいします。,新聞のじはとうとうこまかいです。,とうとうしけんの日が来ました。,わからなかったら、とうとうじしょを見てください。,とうとうしけんの日が来ました。,文脈規定,N4,N4-19-3
きびしい,このパンはきびしくて食べられません。,わたしはきびしいペンをつかっています。,このおちゃはきびしくておいしいです。,社長はきびしい人です。,社長はきびしい人です。,文脈規定,N4,N4-19-4
おれい,先生がにゅういんなさったので、おれいをもっていきました。,プレゼントをもらったので、おれいを言いました。,友だちが来たのでばんごはんにおれいをつくりました。,すずきさんにそつぎょうのおれいをあげました。,プレゼントをもらったので、おれいを言いました。,文脈規定,N4,N4-19-5
よろこぶ,先生におあいできるので、わたしはとてもよろこびます。,プレゼントをもらって、いもうとはとてもよろこんでいます。,このハイキングはほんとうによろこんでいますね。,友だちのいえでよろこぶ時間をすごしました。,プレゼントをもらって、いもうとはとてもよろこんでいます。,文脈規定,N4,N4-19-6
しっかり,このテレビはしっかりふるい。,あの子は小さいけれどもしっかりしている。,テストのためにしっかりにじゅんびした。,あのひとは時間にしっかりとしている。,あの子は小さいけれどもしっかりしている。,文脈規定,N4,N4-19-7
あやまる,こまったときにはすぐにあやまってください。,友だちにおくりものをもらったので、あやまりました。,てつだってもらったときにはかならずあやまってください。,しらない人の足をふんでしまったので、あやまりました。,しらない人の足をふんでしまったので、あやまりました。,文脈規定,N4,N4-19-8
げんいん,12さいいじょうの子どもがこのクラスのげんいんになれます。,あたらしいかいしゃでしごとのげんいんをおしえてもらいました。,けいさつはじこのげんいんをしらべています。,この木をげんいんにしていすをつくりましょう。,けいさつはじこのげんいんをしらべています。,文脈規定,N4,N4-19-9
きびしい,たなか先生はきびしいふくをきています。,たなか先生はきびしい字を書きます。,たなか先生はきびしいかおをしています。,たなか先生はきびしいいぬをもっています。,たなか先生はきびしいかおをしています。,文脈規定,N4,N4-19-10
むかしはきょういくをうけられる人は多くありませんでした。,むかしは多くの人が学校へいけませんでした。,むかしは多くの人が会社へいけませんでした。,むかしは多くの人がおいわいをもらえませんでした。,むかしは多くの入がおみまいをもらえませんでした。,むかしは多くの人が学校へいけませんでした。,文脈規定,N4,N4-18-1
やくそくの時間にまにあいませんでした。,やくそくの時間をわすれました。,やくそくの時間をかえました。,やくそくの時間にもどりました。,やくそくの時間におくれました。,やくそくの時間におくれました。,文脈規定,N4,N4-18-2
うけつけで「お名前とごじゅうしょを書いてください。」と言われました。,うけつけで名前とつとめているところを書きました。,うけつけで名前とすんでいるところを書きました。,うけつけで名前とうまれた日を書きました。,うけつけで名前とうまれた国を書きました。,うけつけで名前とすんでいるところを書きました。,文脈規定,N4,N4-18-3
たなかさんはひっこしがしゅみだそうです。,たなかさんはいろいろなところにいえがあります。,たなかさんはいろいろなところにすむのがすきです。,たなかさんはいろいろなところに出かけるのがすきです。,たなかさんはいろいろなところに行ったことがあります。,たなかさんはいろいろなところにすむのがすきです。,文脈規定,N4,N4-18-4
サッカーがさかんになりました。,サッカーをする人がふえました。,サッカーをする人がへりました。,サッカーがまじめになりました。,サッカーがつまらなくなりました。,サッカーをする人がふえました。,文脈規定,N4,N4-18-5
このもんだいはまちがえやすい。,このもんだいはまちがえる人が少ししかいない。,このもんだいはまちがえる人がぜんぜんいない。,このもんだいはまちがえる人が多い。,このもんだいはまちがえる人が少ない。,このもんだいはまちがえる人が多い。,文脈規定,N4,N4-18-6
病院にいきました。,えを見に行きました。,くるまをかりに行きました。,くすりをとりに行きました。,かみのけをきりに行きました。,くすりをとりに行きました。,文脈規定,N4,N4-18-7
きのうのしゅくだいはかんたんでした。,きのうのしゅくだいはたいへんでした。,きのうのしゅくだいはふくざつでした。,きのうのしゅくだいはやさしかったです。,きのうのしゅくだいはむずかしかったです。,きのうのしゅくだいはやさしかったです。,文脈規定,N4,N4-18-8
あのレストランはいつもすいています。,あのレストランはいつもたべものがおいしいです。,あのレストランはいつもてんいんがしんせつです。,あのレストランはいつもねだんが高いです。,あのレストランはいつもきゃくが少ないです。,あのレストランはいつもきゃくが少ないです。,文脈規定,N4,N4-18-9
すいている電車が来ました。,ひとがすこしものっていない電車が来ました。,ひとがたくさんのっている電車が来ました。,のっているひとがすくない電車が来ました。,のっているひとがいない電車が来ました。,のっているひとがすくない電車が来ました。,文脈規定,N4,N4-18-10
へやの _______ をつけて、あたたかくします。,だんぼう,でんとう,どうぐ,れいぼう,だんぼう,言い換え類義,N4,N4-17-1
先生「みなさん、きょうは _______ 話があります。」,ひつような,しんせつな,だいじな,ねっしんな,だいじな,言い換え類義,N4,N4-17-2
このにくはかたいので、よく _______ 食べてください。,かんで,こんで,のんで,やんで,かんで,言い換え類義,N4,N4-17-3
とうきょうの _______ にちいさないえをかいました。,こうがい,こうこう,こうどう,こくさい,こうがい,言い換え類義,N4,N4-17-4
やすむ人はでんわでわたしに _______ してください。,あんない,れんらく,しょうかい,よしゅう,れんらく,言い換え類義,N4,N4-17-5
"たなか「あしたのパーティーですが、ちょっと行けなくなってしましました。」
さとう「そうですか、それは _______ ですね。」",さかん,ふべん,ざんねん,しつれい,ざんねん,言い換え類義,N4,N4-17-6
毎日 _______ ふくしゅうしてください。,けっして,かならず,ぜんぜん,たいてい,かならず,言い換え類義,N4,N4-17-7
このくすりはとても _______ のみにくいです。,うまくて,こわくて,にがくて,よわくて,にがくて,言い換え類義,N4,N4-17-8
かいぎの時間は、はがき _______ 電話でおしらせします。,けれど,すると,それで,または,または,言い換え類義,N4,N4-17-9
こちらにいらっしゃる _______ があったら、ぜひおよりください。,きかい,きそく,きぶん,きんじょ,きかい,言い換え類義,N4,N4-17-10
かいだんがぬれています。_______ ので、ちゅういしてください。,おちやすい,うごきやすい,すべりやすい,たおれやすい,すべりやすい,言い換え類義,N4,N4-16-1
やさいは _______ きってください。,こまかく,ぬるく,せまく,きびしく,こまかく,言い換え類義,N4,N4-16-2
日本のぶんかについて _______ を書きました。,ワ－プロ,チェック,パソコン,レポ－ト,レポ－ト,言い換え類義,N4,N4-16-3
ほんやの _______ で3000円はらった。,スクリーン,ワープロ,レポート,レジ,レジ,言い換え類義,N4,N4-16-4
_______ ですが、あしたのパーティーには出られません。,むり,いや,ざんねん,ずいぶん,ざんねん,言い換え類義,N4,N4-16-5
おおい,日本にはおおい外国人がすんでいます。,ここは車がおおくてあぶないです。,きょうはおおくつかれました。,わたしにはおおいのこどもがいてたいへんです。,ここは車がおおくてあぶないです。,文脈規定,N4,N4-16-6
いけん,つかいかたがよくわかるように、いけんをしてください。,あの人から「ありがとう。」といけんを言われました。,このことばのいけんをしらべました。,みんなの前でわたしのいけんを言いました。,みんなの前でわたしのいけんを言いました。,文脈規定,N4,N4-16-7
よやく,月へ行くことはわたしのよやくのゆめです。,みんなでごはんを食べるので、レストランをよやくしました。,毎日1時間べんきょうすると母によやくしました。,月よう日はかいものに行くよやくです。,みんなでごはんを食べるので、レストランをよやくしました。,文脈規定,N4,N4-16-8
むかえる,ひるがよるをむかえました。,えきからタクシーを むかえました。,友だちをむかえにくうこうへいきました。,パソコンをむかえてメールを書いています。,友だちをむかえにくうこうへいきました。,文脈規定,N4,N4-16-9
そうだん,べんきょうのしかたを先生にそうだんしました。,かんじがわからないので、じしょにそうだんしました。,つぎの電車が何時かえきいんにそうだんしました。,すきなえいがについて友だちにそうだんしました。,べんきょうのしかたを先生にそうだんしました。,文脈規定,N4,N4-16-10
こんやおもしろいテレビの _______ はありますか。,よやく,ばんぐみ,タイプ,スクリーン,ばんぐみ,言い換え類義,N4,N4-15-1
おなかがすきましたね。_______ しょくじに行きませんか。,だんだん,そろそろ,なかなか,どうどう,そろそろ,言い換え類義,N4,N4-15-2
よく聞こえないので、_______ 大きいこえで話してください。,なるべく,なかなか,ずいぶん,そんなに,なるべく,言い換え類義,N4,N4-15-3
山に木を _______ 。,つけました,とめました,さげました,うえました,うえました,言い換え類義,N4,N4-15-4
わたしは _______ パンがすきです。,おそい,ふかい,やさしい,やわらかい,やわらかい,言い換え類義,N4,N4-15-5
このみちはよるきけんです。,このみちはよるべんりです。,このみちはよるあぶないです。,このみちはよるさびしいです。,このみちはよるにぎやかです。,このみちはよるあぶないです。,文脈規定,N4,N4-15-6
どうぶつをいじめてはいけません。,どうぶつをたいせつにしてください。,どうぶつをあんぜんにしてください。,どうぶつをつかまえてください。,どうぶつをすててください。,どうぶつをたいせつにしてください。,文脈規定,N4,N4-15-7
このへやにはいしゃとかんごふいがいは入らないでください。,このへやにはだれが入ってもいいです。,このへやにはだれも入ってはいけません。,このへやにはいしゃとかんごふは入ってはいけません。,このへやにはいしゃとかんごふは入ってもいいです。,このへやにはいしゃとかんごふは入ってもいいです。,文脈規定,N4,N4-15-8
ゆうべのコンサートはすばらしかったです。,ゆうべはとてもたのしいえいがを見ました。,ゆうべはとてもりっぱなきょうかいを見ました。,ゆうべはとてもうつくしいおんがくを聞きました。,ゆうべはとてもおもしろいほうそうを聞きました。,ゆうべはとてもうつくしいおんがくを聞きました。,文脈規定,N4,N4-15-9
日本語をべんきょうをするつもりです。,日本語をべんきょうをするよていです。,日本語をべんきょうをするはずです。,日本語をべんきょうをするそうです。,日本語をべんきょうをすることができます。,日本語をべんきょうをするよていです。,文脈規定,N4,N4-15-10
一ヶ月50000円 _______ のへやをかりたいです。,いか,いがい,いせん,いっばい,いか,言い換え類義,N4,N4-14-1
このみちはせまい。_______ 、車がおおくてあぶない。,だから,すると,それに,じゃあ,それに,言い換え類義,N4,N4-14-2
_______ たくさん食べても、すぐにおなかがすいてしまいます。,いくら,いかが,どうして,どんな,いくら,言い換え類義,N4,N4-14-3
この川はとても _______ からきけんです。,あさい,ふかい,ひくい,たかい,ふかい,言い換え類義,N4,N4-14-4
母にしなれてほんとうに _______ です。,うるさかった,かなしかった,きびしかった,つまらなかった,かなしかった,言い換え類義,N4,N4-14-5
むすめはそとであそぶより、ひとりで _______ をするのがすきです。,プ－ル,ゲ－ム,ス－ツ,ル－ル,ゲ－ム,言い換え類義,N4,N4-14-6
あにとせの高さを _______ 。,まけました,わかれました,くらべました,つかまえました,くらべました,言い換え類義,N4,N4-14-7
友だちににっきを見られてとても _______ 。,にがかった,ねむかった,はずかしかった,よろしかった,はずかしかった,言い換え類義,N4,N4-14-8
わたしはやまもとさんにりょこうの _______ をもらいました。,おみやげ,おみまい,おまつり,おいわい,おみやげ,言い換え類義,N4,N4-14-9
このとおりは、よるくらくて _______ 。,いたい,こわい,よわい,かなしい,こわい,言い換え類義,N4,N4-14-10
へんじ,テレビのへんじがきこえません。,へんじをだれにかりますか。,へんじをすぐにおこなってしまいました。,名前をよびましたがへんじがありませんでした。,名前をよびましたがへんじがありませんでした。,文脈規定,N4,N4-13-1
そだてる,たいせつにそだてていた花がさきました。,このりょうりはおいしくなるまで、よくそだてました。,なんどもなおしてさくぶんをそだてました。,じが小さくて見えないので、もうすこしそだててください。,たいせつにそだてていた花がさきました。,文脈規定,N4,N4-13-2
すてる,おきゃくさんが来るので、へやをきれいにすててください。,ここにいらないものをすててください。,じゅぎょうでつかう本をかばんにすててください。,ひどいことを言うのはすててください。,ここにいらないものをすててください。,文脈規定,N4,N4-13-3
さむい,さむいタオルでかおをふきました。,なつはさむいビールがおいしいですね。,あの人はさむいです。やさしくありません。,きょうはとくにさむいですね。,きょうはとくにさむいですね。,文脈規定,N4,N4-13-4
さびしい,ねぼうしてしまってさびしかったです。,きょうはさびしいからセーターをきます。,ひとりですんでいるので、ときどきさびしくなります。,このへやはそうじをしていないので、さびしいです。,ひとりですんでいるので、ときどきさびしくなります。,文脈規定,N4,N4-13-5
かたづける,毎日かおをかたづけなさい。,毎日へやをかたづけなさい。,毎日カーテンをかたづけなさい。,毎日きょうみをかたづけなさい。,毎日へやをかたづけなさい。,文脈規定,N4,N4-13-6
すると,きのうは天気がよくなかったです。すると、わたしはテニスをしませんでした。,なんかいも聞きました。すると、わかりませんでした。,バタンをおしました。すると、ドアがあきました。,あしたしけんをします。すると、よくべんきょうしてください。,バタンをおしました。すると、ドアがあきました。,文脈規定,N4,N4-13-7
たいてい,日よう日はたいていスポ－ツをしています。,きょうはたいてい天気がよかったです。,このごろさとうさんにはたいていあっていません。,日本語がたいてい上手になりましたね。,日よう日はたいていスポ－ツをしています。,文脈規定,N4,N4-13-8
したく,このホテルにはよやくのしたくがあります。,かんじのしゅくだいはぜんぶしたくしました。,しょくじのしたくはもうできました。,けいざいをよくするためのしたくをかんがえましょう。,しょくじのしたくはもうできました。,文脈規定,N4,N4-13-9
わかす,あついシャワーをわかしています。,このにくはよくわかしてからたべてください。,おゆをわかしてコーヒーをのみましょう。,へやがひえてきたので、ストーブをわかしてください。,おゆをわかしてコーヒーをのみましょう。,文脈規定,N4,N4-13-10
すずきさん、ちょっとやせましたね。,すずきさん、ちょっとほそくなりました。,すずきさん、ちょっとはじめになりました。,すずきさん、ちょっとうつくしくなりました。,すずきさん、ちょっとじょうぶになりました。,すずきさん、ちょっとほそくなりました。,文脈規定,N4,N4-12-1
わたしはりゅうがくのけいけんがあります。,わたしはりゅうがくのためにべんきょうします。,わたしはりゅうがくをしたいとおもいます。,わたしはりゅうがくをしたことがあります。,わたしはりゅうがくをするよていです。,わたしはりゅうがくをしたことがあります。,文脈規定,N4,N4-12-2
先生はクラスに来なかったわけを聞きました。,先生はいつクラスに来なかったのかたずねました。,先生はだれがクラスに来なかったのかたずねました。,先生はどのぐらいクラスに来なかったのかたずねました。,先生はどうしてクラスに来なかったのかたずねました。,先生はどうしてクラスに来なかったのかたずねました。,文脈規定,N4,N4-12-3
たなかさんのおくさんにすぐれんらくしてください。,たなかさんのおくさんにすぐつたえてください。,たなかさんのおくさんにすぐたずねてください。,たなかさんのおくさんにすぐきいてください。,たなかさんのおくさんにすぐとどけてください。,たなかさんのおくさんにすぐつたえてください。,文脈規定,N4,N4-12-4
まずこのしごとをしてください。,いっしょうけんめいこのしごとをしてください。,はじめにこのしごとをしてください。,なるべくこのしごとをしてください。,しっかりこのしごとをしてください。,はじめにこのしごとをしてください。,文脈規定,N4,N4-12-5
わたしはおがわさんにあやまりました。,わたしはおがわさんに「おめでとうございます。」と言いました。,わたしはおがわさんに「それは　いけませんね。」と言いました。,わたしはおがわさんに「おかげさまで。」と言いました。,わたしはおがわさんに「ごめんなさい。」と言いました。,わたしはおがわさんに「ごめんなさい。」と言いました。,文脈規定,N4,N4-12-6
じをていねいに書きなさい。,まんなかにじを書きなさい。,きれいにじを書きなさい。,おおきくじを書きなさい。,いそいでじを書きなさい。,きれいにじを書きなさい。,文脈規定,N4,N4-12-7
あさの電車はこんでいます。,あさの電車には人がたくさんいます。,あさの電車には人があまりいません。,あさの電車はなかなかきません。,あさの電車はすぐにきます。,あさの電車には人がたくさんいます。,文脈規定,N4,N4-12-8
いっしょうけんめいこのこうぎを聞いています。,はっきりとこのこうぎを聞いています。,てきとうにこのこうぎを聞いています。,ねっしんにこのこうぎを聞いています。,ゆっくりとこのこうぎを聞いています。,ねっしんにこのこうぎを聞いています。,文脈規定,N4,N4-12-9
