けしきのいいところでおべんとうを食べました。,きれいな花がおいてあるレストランで食べました。,きれいな山やもりが見えるこうえんで食べました。,きれいなしゃしんがかけてあるへやで食べました。,きれいなつくえやいすがあるきょうしつで食べました。,きれいな山やもりが見えるこうえんで食べました。,文脈規定,N4,N4-31-1
ほかの人のいけんを聞いてみましょう。,ほかの人が何を見ているか聞いてみましょう。,ほかの人が何をかえているか聞いてみましょう。,ほかの人が何をかんがえているか聞いてみましょう。,ほかの人が何をおこなっているか聞いてみましょう。,ほかの人が何をかんがえているか聞いてみましょう。,文脈規定,N4,N4-31-2
わたしはかみをきってきました。,わたしはりょうかんへ行きました。,わたしはとこやへ行きました。,わたしはこうじょうへ行きました。,わたしはけいさつへ行きました。,わたしはとこやへ行きました。,文脈規定,N4,N4-31-3
わたしはかちょうのかわりにかいぎにいきました。,わたしとかちょうはかいぎにいきました。,わたしとかちょうはかいぎにいきませんでした。,わたしはかいぎにいきましたが、かちょうはいきませんでした。,わたしはかいぎにいきませんでしたが、かちょうはいきました。,わたしはかいぎにいきましたが、かちょうはいきませんでした。,文脈規定,N4,N4-31-4
社長のかわりに田中さんがパーティーにでました。,社長はパーティーにでました。,社長はパーティーにでませんでした。,社長も田中さんもパーティーにでました。,社長も田中さんもパーティーにでませんでした。,社長はパーティーにでませんでした。,文脈規定,N4,N4-31-5
びょういんでさわいではいけません。,びょういんでいそいではいけません。,びょういんでさわってはいけません。,びょういんでさんぽしてはいけません。,びょういんでうるさくしてはいけません。,びょういんでうるさくしてはいけません。,文脈規定,N4,N4-31-6
すずきさんはかならず来ると思います。,すずきさんはきっと来ます。,すずきさんはたまに来ます。,すずきさんはまっすぐ来ます。,すずきさんはゆっくり来ます。,すずきさんはきっと来ます。,文脈規定,N4,N4-31-7
じろうはあかんぼうです。,じろうは生まれて３か月です。,じろうは来年小学校に入ります。,じろうは今年中学校に入ります。,じろうは今年大学をそつぎょうします。,じろうは生まれて３か月です。,文脈規定,N4,N4-31-8
わたしはその人にあいさつしました。,わたしはその人に「それはよかったですね。」と言いました。,わたしはその人に「どうぞおすわりください。」と言いました。,わたしはその人に「おはようございます。」と言いました。,わたしはその人に「もういっぱいいかがですか。」と言いました。,わたしはその人に「おはようございます。」と言いました。,文脈規定,N4,N4-31-9
日がくれました。,空がはれました。,空がくもりました。,空がくらくなりました。,空があかるくなりました。,空がくらくなりました。,文脈規定,N4,N4-31-10
にわにきれいな花を _______ 。,うえましょう,かえましょう,きりましょう,とりましょう,うえましょう,言い換え類義,N4,N4-30-1
このじしょは、かんじを しらべる ときに とても _______ 。,おしえます,さがします,てつだいます,やくにたちます,やくにたちます,言い換え類義,N4,N4-30-2
ここにおいたはずなのですが、かぎが _______ 。,おちません,おとしません,みつけません,みつかりません,みつかりません,言い換え類義,N4,N4-30-3
けっこんしきにだれを _______ しましょうか。,しょうらい,しょうち,しょうたい,しょうかい,しょうたい,言い換え類義,N4,N4-30-4
じぶんのかおを _______ で見ました。,ふとん,たたみ,かがみ,すいどう,かがみ,言い換え類義,N4,N4-30-5
どうぶつえんでは、_______ どうぶつをみることができます。,つまらない,はずかしい,めずらしい,やわらかい,めずらしい,言い換え類義,N4,N4-30-6
これは彼らの問題よ。わたしたちが何を言おうと _______ ないわ。,かんけい,かんしん,かんじ,かんそう,かんけい,言い換え類義,N4,N4-30-7
きみの心を動かすような _______ はいつ現れるのかね。,ひとびと,じょせい,じんせい,にんげん,じょせい,言い換え類義,N4,N4-30-8
どうせわかることだから、隠さないで本当の姿を _______ から見せてしまえばいい。,さいきん,さいこう,さいしょ,さいしゅう,さいしょ,言い換え類義,N4,N4-30-9
ショーンは顔色を _______ 。,きえた,あえた,みえた,かえた,かえた,言い換え類義,N4,N4-30-10
はずかしい,かんたんなもんだいをまちがえて、はずかしいです。,かぞくに会えなくて、はずかしいです。,ピアノがひけるようになって、はずかしいです。,見たいばんぐみがなくて、はずかしいです。,かんたんなもんだいをまちがえて、はずかしいです。,文脈規定,N4,N4-29-1
かしこまりました,Ａ「こうちゃを二つ、おねがいします。」Ｂ「はい、かしこまりました。」,Ａ「あいつので、まどをあけてもいいですか。」Ｂ「はい、かしこまりました。」,Ａ「先生、もういちどいってください。」Ｂ「はい、かしこまりました。」,Ａ「こたえがわかりましたか。」Ｂ「はい、かしこまりました。」,Ａ「こうちゃを二つ、おねがいします。」Ｂ「はい、かしこまりました。」,文脈規定,N4,N4-29-2
ねつ,ねつがあるので、学校をやすみました。,このへやのねつはどのぐらいですか。,このおちゃはねつが高すぎて飲めません。,駅のちかくは人がたくさんいて、ねつがいっぱいです。,ねつがあるので、学校をやすみました。,文脈規定,N4,N4-29-3
ゆっくり,もっとゆっくりにはなしてください。,もっとゆっくりとはなしてください。,もっとゆっくりをはなしてください。,もっとゆっくりではなしてください。,もっとゆっくりとはなしてください。,文脈規定,N4,N4-29-4
まじめ,きょうはまじめな天気で空がきれいです。,さとうを入れないで、まじめなコーヒーを飲みました。,子どもたちは先生の話をまじめに聞いています。,駅はこの道をまじめにいったところにあります。,子どもたちは先生の話をまじめに聞いています。,文脈規定,N4,N4-29-5
あのはなしはうそです。,あのはなしはたいせつです。,あのはなしはたいせつではありません。,あのはなしはほんとうです。,あのはなしはほんとうではありません。,あのはなしはほんとうではありません。,文脈規定,N4,N4-29-6
ずっとそとにいたので、からだがひえてしまいました。,そとはあつかったです。,そとはくらかったです。,そとはさむかったです。,そとはあかるかったです。,そとはさむかったです。,文脈規定,N4,N4-29-7
どろぼうにさいふをぬすまれました。,どろぼうがさいふをひろってくれました。,どろぼうがさいふをとりかえていきました。,どろぼうがさいふをもらってくれました。,どろぼうがさいふをとっていきました。,どろぼうがさいふをとっていきました。,文脈規定,N4,N4-29-8
そろそろしょくじにしましょう。,そろそろごはんを食べましょう。,そろそろしつれいしましょう。,そろそろおふろに入りましょう。,そろそろねましょう。,そろそろごはんを食べましょう。,文脈規定,N4,N4-29-9
ごごからこうぎにしゅっせきします。,ごごから大学で先生とかいぎをします。,ごごから大学で先生の話を聞きます。,ごごから会社で社長とかいぎをします。,ごごから会社で社長の話を聞きます。,ごごから大学で先生の話を聞きます。,文脈規定,N4,N4-29-10
おとうとはわたしより _______ がつよいです。,あたま,げんき,せなか,ちから,ちから,言い換え類義,N4,N4-28-1
このにくは _______ のでうまくきれない。,めずらしい,うつくしい,かたい,あまい,かたい,言い換え類義,N4,N4-28-2
２に３を _______ と５になる。,たす,ひく,けす,やく,たす,言い換え類義,N4,N4-28-3
_______ でんわがありましたよ。,さっき,ちっとも,もうすぐ,ほとんど,さっき,言い換え類義,N4,N4-28-4
ぎんこうを _______ するときには、このカードをもっていきます。,うけつけ,ちゅうい,はいけい,りよう,りよう,言い換え類義,N4,N4-28-5
こんしゅうのつぎは _______ です。,さらいしゅう,さいらいしゅう,らいしゅう,せんしゅう,らいしゅう,言い換え類義,N4,N4-28-6
このへんは _______ ですみやすいですよ。,あんぜん,ふくざつ,しんぱい,ひつよう,あんぜん,言い換え類義,N4,N4-28-7
わたしは _______ で一日3時間はたらいています。,ステレオ,テキスト,アクセサリー,パートタイム,パートタイム,言い換え類義,N4,N4-28-8
わたしのしゅみはりょうりです。たいていはおいしくできますが、たまに _______ します。,けいかく,しっぱい,せいこう,せいさん,しっぱい,言い換え類義,N4,N4-28-9
_______ けれど、しごとがあるからねられません。,すごい,ひどい,ねむい,こわい,ねむい,言い換え類義,N4,N4-28-10
むすめのにゅうがくしきがありました。,むすめがけっこんしました。,むすめがそつぎょうしました。,むすめが大学生になりました。,むすめが社会人になりました。,むすめが大学生になりました。,文脈規定,N4,N4-27-1
日本語はほとんどわすれてしまいました。,日本語はなにもおぼえていません。,日本語はすこししかおぼえていません。,日本語はぜんぶわすれてしまいました。,日本語はすっかりわすれてしまいました。,日本語はすこししかおぼえていません。,文脈規定,N4,N4-27-2
ひさしぶりに山田さんにあいました。,よく山田さんにあっていました。,ときどき山田さんにあっていました。,何時間か山田さんにあっていませんでした。,何年も山田さんにあっていませんでした。,何年も山田さんにあっていませんでした。,文脈規定,N4,N4-27-3
友だちをむかえにくうこうへ行きました。,くうこうで友だちにあいました。,くうこうで友だちをおくりました。,くうこうで友だちを見ました。,くうこうで友だちとわかれました。,くうこうで友だちにあいました。,文脈規定,N4,N4-27-4
ひとりでぜんぶ食べるのはむりです。,ひとりでぜんぶたべられます。,ひとりでぜんぶたべさせます。,ひとりでぜんぶたべられません。,ひとりでぜんぶたべさせません。,ひとりでぜんぶたべられません。,文脈規定,N4,N4-27-5
とうきょうはこうつうがべんりです。,とうきょうはス－パ－やデパ－トがたくさんあります。,とうきょうはたくさんの国の人がせいかつしあています。,とうきょうはバスやちかてつがたくさんはしっています。,とうきょうは駅のそばにたくさんのアパ－トがあります。,とうきょうはバスやちかてつがたくさんはしっています。,文脈規定,N4,N4-27-6
きのうやまもとさんをたずねました。,きのうやまもとさんのしつもんにこたえました。,きのうやまもとさんのいえに行きました。,きのうやまもとさんのしごとをてつだいました。,きのうやまもとさんのつごうを聞きました。,きのうやまもとさんのいえに行きました。,文脈規定,N4,N4-27-7
きびしいじだいはもうすぎました。,じゆうなじだいでした。,しずかなじだいでした。,にぎやかなじだいでした。,たいへんなじだいでした。,たいへんなじだいでした。,文脈規定,N4,N4-27-8
"Ａ「あしたしょくじに行きませんか。」

Ｂ「あしたはちょっと。」",あしたは行けます。,あしたはかまいません。,あしたはだいじょうぶです。,あしたはだめです。,あしたはだめです。,文脈規定,N4,N4-27-9
たまにうんどうします。,うんどうはなにもしていません。,うんどうはいちどもしていません。,うんどうはほとんどしていません。,うんどうはぜんぜんしていません。,うんどうはほとんどしていません。,文脈規定,N4,N4-27-10
わたしは _______ をしながら、大学でべんきょうしています。,アルバイト,サービス,チェック,テキスト,アルバイト,言い換え類義,N4,N4-26-1
さいふはつくえの _______ の中にあります。,おしいれ,ひきだし,カーテン,ベル,ひきだし,言い換え類義,N4,N4-26-2
じしんでいえが _______ います。,ゆれて,きえて,にげて,まわって,ゆれて,言い換え類義,N4,N4-26-3
ことばはぶんかとふかい _______ があると言われています。,はいかん,けいけん,かんけい,そんけい,かんけい,言い換え類義,N4,N4-26-4
今年しけんに _______ しても、また来年がんばります。,しつれい,しっぱい,しゅっせき,しょうたい,しっぱい,言い換え類義,N4,N4-26-5
ずっと日本にすむつもりです。 _______ 今、日本語をべんきょうしています。,では,けれど,それで,たとえば,それで,言い換え類義,N4,N4-26-6
きのうはじこで でんしゃが _______ たいへんでした。,おくれて,おわって,いそいで,まにあって,おくれて,言い換え類義,N4,N4-26-7
このビルの _______ からうみが見えます。,かいがん,おくじょう,じゅうしょ,くうこう,おくじょう,言い換え類義,N4,N4-26-8
外国語の本を日本語に _______ する。,あんない,えんりょ,はんたい,ほんやく,ほんやく,言い換え類義,N4,N4-26-9
新しいじしょをつかってみたけれど、あまり _______ 。,かたづけなかった,とりかえなかった,きをつけなかった,やくにたたなかった,やくにたたなかった,言い換え類義,N4,N4-26-10
さむくなったのでそろそろ _______ がほしいですね。,ゆしゅつ,れいぼう,ゆにゅう,だんぼう,だんぼう,言い換え類義,N4,N4-25-1
あしたはしけんですから、_______ はやく来てください。,なるほど,なるべく,それほど,そんなに,なるべく,言い換え類義,N4,N4-25-2
このまちには、ほんやは _______ しかありません。,いちだい,いちど,いっけん,いっこ,いっけん,言い換え類義,N4,N4-25-3
わたしは毎朝 さんぽするのが _______ です。,しゅうかん,れんしゅう,せいかつ,きょうみ,しゅうかん,言い換え類義,N4,N4-25-4
あたらしい _______ を２だいかいました。,オーバー,ガソリン,ステーキ,パソコン,パソコン,言い換え類義,N4,N4-25-5
てきとう,このきせつはとてもてきとうでよくねむれます。,せんそうは人びとのせいかつにてきとうではありません。,わかい人にてきとうするホテルをしょうかいしてください。,日本についてしらべるのにてきとうな本はありませんか。,日本についてしらべるのにてきとうな本はありませんか。,文脈規定,N4,N4-25-6
おかげさまで,Ａ「ごめんなさい。」Ｂ「いいえ、おかげさまで。」,Ａ「おげんきですか。」Ｂ「ええ、おかげさまで。」,Ａ「それは いけませんね。」Ｂ「ええ、おかげさまで。」,Ａ「ありがとうございました。」Ｂ「いいえ、おかげさまで。」,Ａ「おげんきですか。」Ｂ「ええ、おかげさまで。」,文脈規定,N4,N4-25-7
しかる,「もうだいじょうぶですか。」としかられました。,「よくがんばりましたね。」としかられました。,「もっとまじめにやりなさい。」としかられました。,「いっしょにしらべましょう。」としかられました。,「もっとまじめにやりなさい。」としかられました。,文脈規定,N4,N4-25-8
じゅんび,パーティーのじゅんびができました。,車のこしょりのじゅんびがまだできません。,空気がかわいているので、火事のじゅんびをします。,きょうならったかんじのじゅんびをもういちどいえでします。,パーティーのじゅんびができました。,文脈規定,N4,N4-25-9
うまい,わたしのおとうとはすうがくがうまくありません。,きょうははれて、けしきがうまいです。,わたしのパソコンはいつもうまいです。,わたしはピアノがうまくありません。,わたしはピアノがうまくありません。,文脈規定,N4,N4-25-10
たなかさんは、毎日 _______ にけんきゅうをしている。,あんしん,ざんねん,しんぱい,ねっしん,ねっしん,言い換え類義,N4,N4-24-1
わたしの車は日本 _______ です。,いん,がわ,せい,だい,せい,言い換え類義,N4,N4-24-2
５ _______ おきに木をうえました。,ページ,カーテン,テーブル,メートル,メートル,言い換え類義,N4,N4-24-3
これからはコンピューターの _______ をもつ人がひつようになるだろう。,ぎじゅつ,せつめい,ぼうえき,ゆしゅつ,ぎじゅつ,言い換え類義,N4,N4-24-4
「いま、ファックスをおくってもいいですか。」「ええ、_______ 。」,おだいじに,こちらこそ,かまいません,しつれいします,かまいません,言い換え類義,N4,N4-24-5
１ばんのへや、または２ばんのへやにいってください。,１ばんのへやにいってから、２ばんのへやにいってください。,１ばんのへやにいく前に、２ばんのへやにいってください。,１ばんのへやか２ばんのへやにいってください。,１ばんのへやと２ばんのへやにいってください。,１ばんのへやか２ばんのへやにいってください。,文脈規定,N4,N4-24-6
どうぞえんりょなくめしあがってください。,どうぞたくさんめしあがってください。,どうぞえんりょしながらめしあがってください。,どうぞゆっくりめしあがってください。,どうぞよろこんでめしあがってください。,どうぞたくさんめしあがってください。,文脈規定,N4,N4-24-7
よる１２時に電話がかかってきたのでびっくりしました。,よる１２時に電話がかかってきたのでおこりました。,よる１２時に電話がかかってきたのでおどろきました。,よる１２時に電話がかかってきたのでこまりました。,よる１２時に電話がかかってきたのでなきました。,よる１２時に電話がかかってきたのでおどろきました。,文脈規定,N4,N4-24-8
わたしはやまださんにおれいをいいました。,わたしはやまださんに「おめでとうございます」といいました。,わたしはやまださんに「ありがとうございます」といいました。,わたしはやまださんに「おまたせしました」といいました。,わたしはやまださんに「ごめんください。」といいました。,わたしはやまださんに「ありがとうございます」といいました。,文脈規定,N4,N4-24-9
あした5時に来るのはむりです。,あさいた5時に来ることにします。,あした5時に来なければなりません。,あした5時に来られません。,あした5時に来るようにします。,あした5時に来られません。,文脈規定,N4,N4-24-10
えいがの _______ を２まいかいました。,イベント,サービス,ステレオ,チケット,チケット,言い換え類義,N4,N4-23-1
わたしたちのけっこんは父に _______ 。,はんたいされました,しょうたいされました,しょうかいされました,きょういくされました,はんたいされました,言い換え類義,N4,N4-23-2
あしたのパーティーは、どんなのみものを _______ しましょうか。,しんぱい,しょうたい,しゅっせき,じゅんび,じゅんび,言い換え類義,N4,N4-23-3
だいじなうでどけいがこわれてしまいました。_______ 、とてもお金がかかりました。,かえしたら,すてたら,なおしたら,見つけたら,なおしたら,言い換え類義,N4,N4-23-4
きのうは母のたんじょうびだったので、_______ にくつをあげました。,あいさつ,おいわい,おまつり,おみまい,おいわい,言い換え類義,N4,N4-23-5
このガラスのにんぎょうはこわれやすいので、 _______ ください。,うつらないで,さわらないで,のこらないで,まわらないで,さわらないで,言い換え類義,N4,N4-23-6
子どもが _______ をこわしてしまった。,ぐあい,やくそく,おもちゃ,ぶどう,おもちゃ,言い換え類義,N4,N4-23-7
きょうのおまつりはたいふうのため _______ します。,ちゅうし,しょうかい,ちゅうしゃ,しょうち,ちゅうし,言い換え類義,N4,N4-23-8
でんきだいは毎月ぎんこうで _______ ください。,出して,とどけて,はらって,出かけて,はらって,言い換え類義,N4,N4-23-9
うちを出るとき、「 _______ 。」といいます。,おはようございます,いってまいります,おかえりなさい,ただいま,いってまいります,言い換え類義,N4,N4-23-10
日本ではほんとんど一日中テレビの _______ がある。,きせつ,ほうりつ,ほうそう,きそく,ほうそう,言い換え類義,N4,N4-22-1
かぜで _______ がいたい。,のど,こえ,ひげ,かみ,のど,言い換え類義,N4,N4-22-2
たいふうでまどガラスが _______ 、あぶないです。,われて,よごれて,ふんで,おれて,われて,言い換え類義,N4,N4-22-3
へやに入ると、 _______ にいすがおいてありました。,うら,あと,あいだ,すみ,すみ,言い換え類義,N4,N4-22-4
_______ なりますから、いりぐちににもつをおかないでください。,あんぜんに,じゃまに,じゅうに,むりに,じゃまに,言い換え類義,N4,N4-22-5
いくら,いくらちゅういしてもしずかになりません。,いくらちゅういしたらしずかになりましたか。,ちゅういしてもいくらしずかになりません。,ちゅういしたらいくらしずかになりました。,いくらちゅういしてもしずかになりません。,文脈規定,N4,N4-22-6
ちゅうし,あした雨だったらしあいはちゅうしします。,あの人は会社をちゅうしして大学にいくらしい。,けんこうによくないのでたばこをすうのはちゅうしします。,バスがちゅうしして学校におくれた。,あした雨だったらしあいはちゅうしします。,文脈規定,N4,N4-22-7
きかい,ざんねんですが、その日はべつのきかいがあります。,わたしは日本のれきしにきかいがあります。,両親は外国へいったきかいがありません。,近くに来るきかいがあったら、ぜひあそびに来てください。,近くに来るきかいがあったら、ぜひあそびに来てください。,文脈規定,N4,N4-22-8
あんぜん,このまちはよるもあんぜんです。,にちようびはいつもいえであんぜんにしています。,このきかいはあんぜんてきにつかってください。,わたしはげんきですから、あんぜんしてください。,このまちはよるもあんぜんです。,文脈規定,N4,N4-22-9
さしあげる,つまにピアノをさしあげました。,先生にケーキをさしあげました。,とりにむしをさしあげました。,花に水をさしあげました。,先生にケーキをさしあげました。,文脈規定,N4,N4-22-10
わからないことばは じじょで _______ ください。,よんで,きめて,しらべて,くらべて,しらべて,言い換え類義,N4,N4-21-1
このテストは７０てん _______ とるとそつぎょうできます。,いか,いがい,いじょう,いない,いじょう,言い換え類義,N4,N4-21-2
らいねんのカレンダーをへやの _______ にかけました。,かべ,もん,たたみ,おくじょう,かべ,言い換え類義,N4,N4-21-3
大きなにもつをはこんで _______ がいたくなった。,うで,のど,ひげ,みみ,うで,言い換え類義,N4,N4-21-4
